{
  "level": "ERROR",
  "message": "Failed to execute control command: timeout waiting for acknowledgment",
  "context": {
    "component": "flight_ctl",
    "operation": "set_mode",
    "target_mode": "AUTO",
    "timeout_ms": 3000
  },
  "error": {
    "type": "CommandTimeoutError",
    "code": "MAL-1004",
    "stack": "at CommandExecutor.execute (executor.js:142)\nat FlightController.setMode (controller.js:87)",
    "cause": "Target component did not respond within TTL window"
  },
  "trace": {
    "traceId": "550e8400-e29b-41d4-a716-446655440000",
    "spanId": "6ba7b810-9dad-11d1-80b4-00c04fd430c8",
    "parentSpanId": "7c9e6679-7425-40de-944b-e07fc1f90ae7"
  },
  "flightRecorder": {
    "segmentId": "seg-00142",
    "previousHash": "sha256:a1b2c3d4e5f6...",
    "signature": "base64(ed25519(...))",
    "sealed": true
  },
  "tags": {
    "severity": "high",
    "mission": "sim-H0-2025-10-03",
    "component": "control_plane"
  }
}
